{
  "$schema": "https://json-schema.org/draft/2020-12/schema",
  "x-select": ["roster"],
  "title": "Roster",
  "description": "One roster: a favourite team setup, named so it can be dispatched again without being rebuilt. A roster is roles information; a dispatch is an instance of it. Filed by name, recon.json.",
  "type": "object",
  "required": ["kind", "name", "purpose", "seats"],
  "properties": {
    "kind": {
      "description": "the word roster, which is what chooses this schema",
      "const": "roster"
    },
    "name": {
      "description": "the roster's name in lowercase with hyphens, the same name the file is named for; a roster carries a name, not an identifier",
      "type": "string",
      "pattern": "^[a-z][a-z0-9-]*$"
    },
    "purpose": {
      "description": "the kind of work this setup is for, in one line",
      "type": "string",
      "minLength": 1
    },
    "seats": {
      "description": "the seat names this roster calls for, a list matching crew dossiers",
      "type": "array",
      "minItems": 1,
      "items": { "type": "string", "pattern": "^[a-z][a-z0-9-]*$" }
    },
    "shape": {
      "description": "how the seats are arranged and run, in one or two sentences",
      "type": "string",
      "minLength": 1
    },
    "updated": {
      "description": "the date the roster was last changed, YYYY-MM-DD",
      "type": "string",
      "pattern": "^[0-9]{4}-[0-9]{2}-[0-9]{2}$"
    }
  }
}
